{"$schema":"https://json-schema.org/draft/2020-12/schema","type":"object","additionalProperties":false,"properties":{"contractVersion":{"const":"planning-task/v2"},"status":{"const":"planned"},"id":{"type":"string","pattern":"^[TC][0-9]{2}$"},"title":{"type":"string","minLength":1},"dependencies":{"type":"array","items":{"type":"string","minLength":1},"uniqueItems":true},"writePaths":{"type":"array","items":{"type":"string","minLength":1},"uniqueItems":true},"acceptanceIds":{"type":"array","items":{"type":"string","minLength":1},"minItems":1,"uniqueItems":true},"sourceRefs":{"type":"array","items":{"type":"string","minLength":1}},"implementationSteps":{"type":"array","items":{"type":"string","minLength":1},"minItems":2},"redTests":{"type":"array","items":{"type":"string","minLength":1},"minItems":2},"deliverables":{"type":"array","items":{"type":"string","minLength":1},"minItems":1},"rollback":{"type":"string","minLength":1},"commonContract":{"type":"string","minLength":1},"contextPacketId":{"type":"string","minLength":1}},"required":["contractVersion","status","id","title","dependencies","writePaths","acceptanceIds","sourceRefs","implementationSteps","redTests","deliverables","rollback","commonContract","contextPacketId"]}
