{"contractVersion":"planning-task/v2","status":"planned","id":"T12","title":"Construir provas determinísticas do protocolo real","dependencies":["T06","T08","T10","T11","T14"],"writePaths":["scripts/qualification/actions/protocol/**","scripts/qualification/fixtures/v2/**","tests/qualification/deterministic/**","tests/contracts/protocol-proofs-v2.test.mjs"],"acceptanceIds":["AP-06","AP-11","AP-12","AP-20","AP-22","AP-42"],"sourceRefs":["S14","S15"],"implementationSteps":["Montar provider controlado nos protocolos reais; testar DB, fila e Rust worker reais e fault boundary física.","Cobrir success/failure, structured malformation, timeouts, replay, Redis/TEI outage e restoration.","Mapear provas a R-7/R-8/R-9/R-10/R-11 preservando live-adapter separado."],"redTests":["Process loss sem PID/replacement real não prova recuperação.","Provider fixture não pode acessar API remota e não pode gerar receipt live."],"deliverables":["corpus protocol positivo/negativo","mapa de equivalência R0–R11","mutation report"],"rollback":"Retornar suite v1 completa; não remover os novos testes negativos por instabilidade.","commonContract":"README.md","contextPacketId":"T12"}
