{"contractVersion":"planning-task/v2","status":"planned","id":"T10","title":"Criar planner de qualificação e receipt CAS","dependencies":["T01","T02"],"writePaths":["packages/qualification-core/**","scripts/qualification/engine/**","tests/contracts/qualification-planner-v2.test.mjs"],"acceptanceIds":["AP-06","AP-07","AP-08","AP-09","AP-10","AP-20"],"sourceRefs":["S15","S16"],"implementationSteps":["Criar proof graph e ActionReceipt CAS isolado dos context caches e de ProjectMemory.","Derivar ações por diff/closure/policy/runner com invalidação conservadora para input desconhecido.","Certificar novo SHA com receipt provenance; nunca herdar PASS por similaridade ou cache de saúde."],"redTests":["Troca de prompt/AGENTS/schema/test/policy/toolchain invalida proofs dependentes.","Receipt semantic candidate ou dirty snapshot não autoriza release."],"deliverables":["qualification planner e scheduler","receipt store/verifier","explain report por objetivo"],"rollback":"Ignorar receipt CAS e executar plano completo; preservar formato legado para bootstrapping da confiança.","commonContract":"README.md","contextPacketId":"T10"}
