{"contractVersion":"planning-task/v2","status":"planned","id":"T11","title":"Otimizar preparação e builds sem perder identidade","dependencies":["T02","T03","T10"],"writePaths":["compose.yaml","infra/docker/**","scripts/qualification/actions/build/**","scripts/qualification/actions/environment/**","tests/contracts/build-environment-v2.test.mjs"],"acceptanceIds":["AP-20","AP-23","AP-26","AP-38"],"sourceRefs":["S01","S15"],"implementationSteps":["Reusar imagem/dependências por digest e separar cold downloads de warm execution.","Usar resource leases para CPU/RAM/ports/target dirs e concorrência bounded.","Reusar infraestrutura sem compartilhar autoridade/dados de outro consumidor; probes de saúde continuam atuais."],"redTests":["Imagem/input diferente invalida build receipt.","Dois jobs em mesmo target/port não passam por corrida; warm DB alheio não vira fixture."],"deliverables":["build actions e logs layer cache","isolated environment leases","warm/cold comparison"],"rollback":"Usar build frio por digest/inputs atuais; não reutilizar volumes mutáveis antigos em rollback.","commonContract":"README.md","contextPacketId":"T11"}
