{"contractVersion":"planning-task/v2","status":"planned","id":"T01","title":"Definir contratos canônicos versionados","dependencies":["T00"],"writePaths":["packages/harness-contracts/**","tests/contracts/portable-contracts.test.mjs",".agents/schemas/task-brief.schema.json",".agents/schemas/execution-plan.schema.json",".agents/schemas/context-packet.schema.json",".agents/schemas/implementation-plan.schema.json"],"acceptanceIds":["AP-03","AP-04","AP-13"],"sourceRefs":["S13","S14","S16"],"implementationSteps":["Definir schemas versionados para descriptor, command, evidence, envelope, scope, budget, receipt e certificate.","Usar união discriminada para fatos e validar normalizador/projetor contra mesmos vetores.","Especificar compatibilidade e rejeição de campos/versões desconhecidos sem converter declaração em autorização."],"redTests":["source=reasoning no ramo review deve ter aceitação consistente; no ramo authoritative-context não.","Campos extras, versão desconhecida e reference inválida falham fechado."],"deliverables":["schemas/types/codecs e vetores","testes diferenciais de todos os consumidores do contrato"],"rollback":"Desabilitar leitura v2 na policy e manter codec legado; não reescrever registros históricos.","commonContract":"README.md","contextPacketId":"T01"}
