{"contractVersion":"planning-task/v2","status":"planned","id":"T14","title":"Fortalecer ingress e adapters de sessão","dependencies":["T01","T02","T03"],"writePaths":[".opencode/plugins/runtime-invocation-provenance.js",".opencode/tools/runtime-continuation.ts","apps/context-engine/src/invocation-provenance.ts","apps/context-engine/src/request-context.ts","apps/context-engine/src/http.ts","apps/context-engine/src/tools/agent-runtime.ts",".agents/runtime/session-adapter.mjs","apps/context-engine/test/agent-runtime-session-authority.test.ts","apps/context-engine/test/invocation-provenance.test.ts","tests/contracts/agent-start-session-authority.test.mjs","tests/contracts/agent-start-current-user-message-authority.test.mjs"],"acceptanceIds":["AP-12","AP-16","AP-19","AP-24","AP-36","AP-41"],"sourceRefs":["S08","S09"],"implementationSteps":["Fortalecer current-user-message com session/call/nonce binding atômico, digest/size e expiry.","Preservar bytes originais/multipart; normalização derivada com identidade distinta, sem reemitir prompt via LLM.","Isolar adapter OpenCode e manter one-shot provenance em retry/concurrency; reference de attachment é explícita."],"redTests":["Duas sessões com args idênticos não consomem registro uma da outra.","Replay/expired nonce, trim silencioso e hash mismatch são rejeitados ou explicitamente representados."],"deliverables":["invocation binding versionado","conformance de session adapter","testes concorrentes e quotas"],"rollback":"Desabilitar novo profile/broker e retornar o modo de request explícita curta qualificado; não aceitar source sem provenance.","commonContract":"README.md","contextPacketId":"T14"}
