{"contractVersion":"planning-task/v2","status":"planned","id":"T02","title":"Unificar identidade de source e manifest","dependencies":["T01"],"writePaths":["packages/source-identity/**","scripts/internal/source-manifest.mjs","tests/contracts/source-identity-v2.test.mjs"],"acceptanceIds":["AP-04","AP-05","AP-08","AP-09","AP-24"],"sourceRefs":["S16"],"implementationSteps":["Implementar codec canônico comum e reader v1 explícito; cobrir ordem de keys, UTF-8, file mode, symlink e gitlink.","Gerador e verifier devem usar o mesmo algoritmo/versão e leitura batch de objetos.","Separar identidade de source, config pública, policy e referências privadas; nunca publicar digest bruto de segredo."],"redTests":["Reordenar propriedades preserva digest sem permitir arquivo extra/adulterado.","Unicode/CRLF/mode/gitlink/symlink escape produzem a decisão definida no contrato."],"deliverables":["biblioteca de source identity","CLI compatível de manifest","vetores cross-platform e benchmark de subprocessos"],"rollback":"Conservar verificador legado por schemaVersion; publicar v2 somente com bridge evidence; voltar ao pin anterior em rollback.","commonContract":"README.md","contextPacketId":"T02"}
