{"contractVersion":"planning-task/v2","status":"planned","id":"T07","title":"Introduzir SemanticBroker com budget único","dependencies":["T01","T14"],"writePaths":["packages/semantic-broker/**","packages/harness-kernel/budgets/**",".agents/runtime/opencode-structured-output.mjs",".agents/runtime/model-router.mjs",".agents/runtime/retry-efficiency.mjs",".agents/model-routing.json","tests/contracts/semantic-budget-v2.test.mjs"],"acceptanceIds":["AP-06","AP-17","AP-18","AP-19","AP-21","AP-24","AP-39"],"sourceRefs":["S10","S12"],"implementationSteps":["Implementar admission/budget único ao redor de routing e structured output existentes, não uma segunda memória/cache.","Contar primária/auxiliary/retry/fallback e startup no mesmo ledger; erro repetido sem progresso encerra bounded repair.","Primeiro eliminar chamadas mecânicas; só introduzir pool de servidores se benchmark e testes provarem benefício/isolamento."],"redTests":["Fallback não pode ultrapassar budget nem chamar remoto em perfil zero-remote.","Servidor reusado não vaza auth, histórico ou workspace de outro projeto."],"deliverables":["broker/adapter e ledger","métricas completas inclusive tentativas falhas","benchmark before/after de lifecycle"],"rollback":"Desligar pooling e usar backend antigo pela mesma interface; budgets/fail-closed permanecem ativos.","commonContract":"README.md","contextPacketId":"T07"}
