{"contractVersion":"planning-task/v2","status":"planned","id":"T18","title":"Preservar e fortalecer L1/L2 exact e pool Redis","dependencies":["T01","T02","T03"],"writePaths":["packages/context-cache/**","packages/context-redis/**","tests/contracts/context-exact-parity.test.mjs"],"acceptanceIds":["AP-27","AP-28","AP-29"],"sourceRefs":["S01","S02","S03"],"implementationSteps":["Inventariar TTL/no-TTL, promoção L2→L1, dependency invalidation e namespace; criar testes de isolamento e stale concorrente.","Implementar apenas gaps reproduzidos de scope/freshness; manter consenso de réplicas, deadlines/cooldown e escrita L2-first.","Não criar Redis pool por request nem usar flush-all; versionar namespace quando formato mudar."],"redTests":["Fresh+stale e membro down nunca retornam exact HIT.","Fail-closed write que falha não deixa L1 novo; exact hit válido preserva semântica existente."],"deliverables":["Testes de paridade/negativos","Deltas de contrato/configuração e migração documentados","Handoff com dados observados/estimados separados"],"rollback":"Reativar implementação/namespace compatível anterior sem apagar dados; entries novas tornam-se MISS.","commonContract":"README.md","contextPacketId":"T18"}
