{"contractVersion":"planning-task/v2","status":"planned","id":"T06","title":"Unificar fatos, evidência e autoridade de handoffs","dependencies":["T01","T09"],"writePaths":[".agents/runtime/bootstrap-capabilities.mjs",".agents/runtime/product-discovery-bootstrap-assessment.mjs",".agents/runtime/review-contract.mjs",".agents/runtime/handoff-contract.mjs",".agents/runtime/handoff-structured-finalization.mjs",".agents/schemas/handoff-result.schema.json",".agents/agents/product-owner/AGENT.md","packages/harness-kernel/authority/**","tests/contracts/artifact-authority-v2.test.mjs"],"acceptanceIds":["AP-13","AP-14","AP-15","AP-17"],"sourceRefs":["S14"],"implementationSteps":["Convergir normalizador/schema/projeção dos fatos e ArtifactEnvelope, mantendo revisão do produtor autoritativo.","Consumir ResolvedEvidence; canonicalizar somente formato comprovável e manter ambiguity fail-closed.","Aplicar mesmas decisões em repair e completion sem aprovar review negativo por normalização."],"redTests":["Anchor inventado não é legitimado pelo path existir.","Eco revision=1 em implementation não invalida Technical Refinement r2; dois produtores autoritativos conflitantes falham."],"deliverables":["serviço único de autoridade","transformações registradas","regressões do incidente e casos adversariais"],"rollback":"Conservar leitura dos artefatos antigos, mas não relaxar a validação nova; rollback de schema só mediante versão/policy explícita.","commonContract":"README.md","contextPacketId":"T06"}
