{"contractVersion":"planning-task/v2","status":"planned","id":"T17","title":"Fechar documentação e publicar candidato qualificado","dependencies":["T15","T16"],"writePaths":["docs/operations/portable-harness-v2.md","docs/qualification/QUALIFICATION-V2.md","docs/architecture/PORTABLE-HARNESS-V2.md","MANIFEST.json"],"acceptanceIds":["AP-25"],"sourceRefs":["S15","S16"],"implementationSteps":["Consolidar ADRs aceitas/contratos/docs operacionais e revalidar traceability/ownership.","Regenerar manifest pelo script oficial em source final, commitar, qualificar SHA exato e produzir certificado real.","Publicação/promoção são controller-host e dependem de autorização/gates; preservar rollback/dados."],"redTests":["HOLD/NOT_RUN/unknown receipt impede release.","Commit diferente do certificado ou source dirty impede promoção."],"deliverables":["runbook e docs publicáveis","manifest canônico","release handoff/certificado/bridge"],"rollback":"Fixar consumidores no release anterior; drenar runs por versão; nunca git reset --hard nem force-push como mecanismo automático.","commonContract":"README.md","contextPacketId":"T17"}
