{"contractVersion":"planning-task/v2","status":"planned","id":"T09","title":"Fornecer evidência compacta verificável","dependencies":["T01","T02","T03","T18","T19","T20"],"writePaths":[".agents/runtime/context-builder.mjs",".agents/runtime/agent-input-manifest.mjs","packages/context-pack/src/**","packages/context-pack/test/**","packages/harness-kernel/evidence/**","tests/contracts/resolved-evidence-v2.test.mjs"],"acceptanceIds":["AP-15","AP-24","AP-30","AP-31","AP-32","AP-33","AP-35","AP-36","AP-37","AP-39"],"sourceRefs":["S04","S05","S06","S11"],"implementationSteps":["Evoluir ContextPackBuilder/ReferenceStore/StaticArtifactCache existentes para evidência resolvida com scope/hash/trecho.","Manter raw independente de budget, exact-before-semantic, componentes e compact/lazy delivery; incorporar identidades de T18/T19/T20.","Não cortar evidence obrigatória silenciosamente; diferenciar summaries seam de funcionalidade ativa e manter compatibilidade."],"redTests":["L1/L2 hit não chama embedding; budget menor reaproveita raw mas não payload incompatível.","Referência cross-project, anchor ausente ou conteúdo alterado falha antes de entrega."],"deliverables":["ResolvedEvidence resolver","cache exato de análise local","medição evidenceBytes/context duplication"],"rollback":"Desligar cache derivado e reconstruir do snapshot; não desativar verificação de hash/selector.","commonContract":"README.md","contextPacketId":"T09"}
