{"contractVersion":"planning-task/v2","status":"planned","id":"T00","title":"Congelar baseline e reconciliar telemetria","dependencies":[],"writePaths":[],"acceptanceIds":["AP-21"],"sourceRefs":["S01","S04","S15","S16"],"implementationSteps":["Fixar branch/HEAD, source status, entrypoints e configuração; inventariar P01–P16 sem executar modelo.","Extrair relatórios históricos e medir fase/subfase; distinguir baseline testado de propriedade ainda não provada.","Resolver owners/paths, suites existentes, comandos e dependências no checkout; atualizar o planning graph explicitamente se necessário."],"redTests":["Projetos homônimos e dois entrypoints não podem sumir do inventário.","Relatório HOLD/NOT_RUN não pode ser contabilizado como PASS nem inferência total."],"deliverables":["baseline-target-host.json fora da árvore de source","suite-inventory.json","path-map-review.json"],"rollback":"Somente artefatos externos de análise; nenhum source a reverter.","commonContract":"README.md","contextPacketId":"T00"}
