{"contractVersion":"planning-task/v2","status":"planned","id":"T03","title":"Criar ProjectDescriptor e adapters de projeto","dependencies":["T01","T02"],"writePaths":["packages/project-adapters/**","tests/contracts/project-descriptor.test.mjs"],"acceptanceIds":["AP-01","AP-02","AP-26","AP-31","AP-38"],"sourceRefs":["S01","S13"],"implementationSteps":["Criar ProjectDescriptor e adapters declarativos por módulo e runner; detectar sem executar scripts.","Dar identidade estável por projeto e policy de relocação/fork; eliminar dependência de layout apps/*.","Exigir capabilities/toolchains declaradas e doc roots; manter defaults por adapter compatível."],"redTests":["Python/Go/Rust/docs-only sem package.json não invocam npm.","Projetos homônimos e monorepo com dois managers recebem scopes e comandos distintos."],"deliverables":["loader/detectors e adapter conformance","descriptor proposal vs approved distinction"],"rollback":"Manter descriptor legado disponível como preset explícito; rollback remove ativação v2, não altera source do consumidor.","commonContract":"README.md","contextPacketId":"T03"}
