{"contractVersion":"planning-task/v2","status":"planned","id":"T16","title":"Medir ganhos e verificar budgets","dependencies":["T00","T13","T15"],"writePaths":["scripts/qualification/benchmark.mjs","tests/contracts/qualification-performance-v2.test.mjs"],"acceptanceIds":["AP-18","AP-21","AP-23","AP-37","AP-40"],"sourceRefs":["S01","S06","S10","S12","S15"],"implementationSteps":["Instrumentar e medir fases, critical path, hits/misses, embeddings, retrieval, tokens e custos conhecidos/estimados.","Comparar baseline e candidato com corpus/config/hardware fixos, warm/cold/degraded e zero-remote observado.","Reportar amostra/estimador/p95 e falhas; não mudar thresholds/qualidade para cumprir meta."],"redTests":["Somar spans paralelos não pode ser apresentado como wall time.","Savings estimado + provider cached tokens não podem duplicar economia financeira."],"deliverables":["benchmark runner","raw samples sanitizados e análise","decisão de ganhos observados vs metas"],"rollback":"Não ativar pooling/cache/parallelismo que regrida qualidade ou p95; reverter otimização específica, não enforcement.","commonContract":"README.md","contextPacketId":"T16"}
