{"contractVersion":"planning-task/v2","status":"planned","id":"T21","title":"Integrar eficiência/contexto preservados no runtime","dependencies":["T03","T09","T18","T19","T20"],"writePaths":["apps/context-engine/src/runtime-services.ts","apps/context-engine/src/task-context-service.ts","apps/context-engine/src/semantic-cache-config.ts","apps/context-engine/src/stats.ts","apps/context-engine/src/visibility.ts","apps/context-engine/test/context-economy-parity.test.ts","tests/contracts/context-economy-parity.test.mjs","apps/context-engine/test/runtime-services.test.ts"],"acceptanceIds":["AP-27","AP-28","AP-29","AP-30","AP-32","AP-34","AP-36","AP-37","AP-38","AP-39","AP-40"],"sourceRefs":["S01","S02","S04","S05","S06","S12"],"implementationSteps":["Integrar descriptor, scope e stores existentes num runtime/pool compartilhado; não duplicar Context Engine em SemanticBroker.","Verificar exact-first, source revision probes, memória, raw/component/static caches e compact delivery pelo caminho real do contextProvider.","Preservar campos públicos exact/semantic; instrumentar cache/embedding/retrieval/model e unknown vs zero sem dupla contagem."],"redTests":["Warm exact lookup tem zero chamadas a semantic/embedding e entrega validada.","Cold/warm/degraded e mudança de budget/policy preservam autoridade e telemetria; missing required dependency não vira payload vazio de sucesso."],"deliverables":["Testes de paridade/negativos","Deltas de contrato/configuração e migração documentados","Handoff com dados observados/estimados separados"],"rollback":"Restaurar wiring e settings anteriores com paridade; não reconfigurar pin/failure mode silenciosamente.","commonContract":"README.md","contextPacketId":"T21"}
