{"contractVersion":"planning-task/v2","status":"planned","id":"T08","title":"Convergir kernel, executor e finalizer","dependencies":["T04","T05","T06","T07","T09","T14","T21"],"writePaths":["packages/harness-kernel/execution/**",".agents/runtime/control-plane.mjs",".agents/runtime/executor.mjs",".agents/runtime/event-driven-preparation.mjs",".agents/runtime/event-driven-finalizer.mjs",".agents/runtime/event-driven-reconciler.mjs",".agents/runtime/policy-engine.mjs",".agents/runtime/run-invariants.mjs","apps/runtime-worker/src/**","tests/contracts/deterministic-kernel-v2.test.mjs"],"acceptanceIds":["AP-11","AP-12","AP-14","AP-17","AP-18","AP-21","AP-42"],"sourceRefs":["S10","S14"],"implementationSteps":["Extrair funções compartilhadas de autoridade/normalização/completion para kernel com fachadas legadas.","Conectar execução direta, child launcher e finalizer event-driven; preservar envelope/leases/fencing e outbox.","Provar same-attempt repair, replay idempotente e checkpoints antes de retirar duplicação."],"redTests":["Mesma entrada pelos entrypoints não gera decisões divergentes.","Process loss em repair não repete OpenCode completo nem integra efeito twice."],"deliverables":["kernel/compatibility façades","receipt e transition tests","paridade de finalização e recovery"],"rollback":"Parar admissão v2, drenar runs por versão e voltar ao adapter antigo; nunca converter checkpoint v2 em v1 sem codec validado.","commonContract":"README.md","contextPacketId":"T08"}
