{"contractVersion":"planning-task/v2","status":"planned","id":"T19","title":"Preservar semantic candidate cache e revalidação","dependencies":["T01","T02","T03"],"writePaths":["packages/context-semantic-cache/**","tests/contracts/context-semantic-parity.test.mjs"],"acceptanceIds":["AP-29","AP-32","AP-33"],"sourceRefs":["S01","S05"],"implementationSteps":["Fixar contratos de lookup/put, allowlist, modes off/observe/enforce e failureMode open/closed.","Testar scope/model/revision/hash/coverage e stale rejection, top-k e pooling; manter tokens estimados separados.","Preservar candidate-only: não autorizar resposta final, review ou proof receipt pelo cache."],"redTests":["Alta similaridade com branch/role/schema/model divergente é rejeitada.","Observe não reusa componentes; rejection contabiliza uma lookup, não cada candidato."],"deliverables":["Testes de paridade/negativos","Deltas de contrato/configuração e migração documentados","Handoff com dados observados/estimados separados"],"rollback":"Restaurar configuração/versionamento anterior; não ler entradas incompatíveis nem promover semantic para exact.","commonContract":"README.md","contextPacketId":"T19"}
