{"contractVersion":"planning-task/v2","status":"planned","id":"T15","title":"Provar agnosticismo e fronteiras de confiança","dependencies":["T13","T18","T19","T20","T21"],"writePaths":["tests/portability/**","tests/security/evolution/**","tests/contracts/evolution-behavior.test.mjs"],"acceptanceIds":["AP-01","AP-02","AP-03","AP-05","AP-06","AP-08","AP-11","AP-12","AP-14","AP-15","AP-16","AP-19","AP-22","AP-26","AP-41","AP-42"],"sourceRefs":["S01","S14","S15"],"implementationSteps":["Executar matriz de adapters/projetos/plataformas e invariantes P01–P16 após integração.","Adicionar negativos/mutations em semantic/command/receipt/scope/source e comparar caminhos legados.","Separar suporte, no-impact e falta de ambiente; testes indisponíveis não viram skip/PASS."],"redTests":["Mutar trust/namespace/fencing faz gate falhar.","Redis/PG ausente em prova que os exige resulta HOLD explícito."],"deliverables":["portability-matrix-result.json","negative/mutation report","handoff QA de execução real"],"rollback":"HOLD de promoção até gaps bloqueantes resolvidos; não reduzir matriz para aprovar.","commonContract":"README.md","contextPacketId":"T15"}
