{"contractVersion":"planning-task/v2","status":"planned","id":"T13","title":"Integrar CLI e perfis de qualificação","dependencies":["T03","T04","T05","T07","T09","T10","T11","T12","T14","T21"],"writePaths":["bin/harness.mjs","scripts/harness-qualify.mjs","scripts/qualification/standalone-v1.mjs","scripts/harness-doctor.mjs","scripts/harness-bootstrap.mjs","scripts/harness-test.mjs","package.json","package-lock.json",".agents/agents/main-orchestrator/AGENT.md","tests/contracts/config.test.mjs","tests/contracts/qualification-controller.test.mjs","tests/contracts/qualification-cli-v2.test.mjs"],"acceptanceIds":["AP-02","AP-06","AP-07","AP-09","AP-10","AP-22","AP-25"],"sourceRefs":["S01","S13","S15"],"implementationSteps":["Integrar --profile/--subject/--explain apenas após engine implementado, mantendo aliases legados explícitos.","Qualificação consumer não reseta root/subject para standalone; discovery inclui TS/Vitest/Rust/conformance.","Trocar contagens fixas por distribuição/capabilities e integrar dependências root sem conflito de ownership."],"redTests":["Flag desconhecida falha sem fallback silencioso.","Novo schema/capability legítimo não falha por contagem fixa; falta de suite requerida falha."],"deliverables":["CLI implementada e documentação de help","discovery de suites","compatibility/namespace tests"],"rollback":"Reverter roteamento CLI a v1; manter novos profiles indisponíveis, não reinterpretar flags antigas.","commonContract":"README.md","contextPacketId":"T13"}
