{"contractVersion":"planning-task/v2","status":"planned","id":"T04","title":"Substituir autoridade textual de comandos","dependencies":["T01","T03"],"writePaths":[".agents/runtime/validation-command.mjs",".agents/runtime/technical-plan-synthesis.mjs","scripts/internal/agent-runtime-validation-toolchain-preflight.mjs","tests/contracts/command-authority-v2.test.mjs"],"acceptanceIds":["AP-01","AP-03"],"sourceRefs":["S13"],"implementationSteps":["Trocar autoridade de command strings por CommandSpec IDs aprovados, preservando adapter legado explícito.","Integrar catálogo, compiler e toolchain preflight com argv/cwd/runner/effects e validação de scope.","Modelo não pode autorizar novo comando via criterion.verification ou implementationPlan."],"redTests":["String de prosa executável ou commandId inexistente não vira validação.","Shell injection, cwd escape e execução host dentro de implementation são rejeitados."],"deliverables":["catálogo tipado e bridge legacy","schemas de plan/synthesis alimentados por contrato único","testes de quoting/escopo/effects"],"rollback":"Ler apenas catálogo legado aprovado sob feature version; impedir misturar IDs v2 e strings não verificadas.","commonContract":"README.md","contextPacketId":"T04"}
