{"contractVersion":"planning-task/v2","status":"planned","id":"T20","title":"Preservar ProjectMemory PostgreSQL e identidade","dependencies":["T01","T02","T03"],"writePaths":["packages/project-memory/**","tests/contracts/project-memory-parity.test.mjs","infra/postgres/migrations/**"],"acceptanceIds":["AP-34","AP-35"],"sourceRefs":["S01","S05","S07"],"implementationSteps":["Testar isolamento por projectId, revision ledger, concurrent writes, persist/restart e FTS/Unicode/phrase/OR existentes.","Corrigir gaps somente com migração/backfill/idempotência explícitos; mapear migration path vigente antes de criar DDL e revisar ownership.","Manter Decision.files histórico como relevância; memory revision autoriza freshness, nunca aprovação de tarefa."],"redTests":["Renomear arquivo histórico sem mudar memória não torna snapshot permanentemente stale.","Mudar Decision/TaskRecord avança revisão e invalida lookups; projetos homônimos não leem memória alheia."],"deliverables":["Testes de paridade/negativos","Deltas de contrato/configuração e migração documentados","Handoff com dados observados/estimados separados"],"rollback":"Backup/restauração e reader compatível; downgrade guard quando migração não reversível, sem truncar store.","commonContract":"README.md","contextPacketId":"T20"}
