{"contractVersion":"planning-task/v2","status":"planned","id":"T05","title":"Desacoplar catálogo de agentes e workflow do domínio","dependencies":["T01","T03"],"writePaths":[".agents/runtime/agent-catalog.mjs",".agents/runtime/agent-topology.mjs",".agents/runtime/dag-compiler.mjs",".agents/workflow.json",".agents/agents/*/agent.json","packages/harness-kernel/planning/**","tests/contracts/workflow-policy-v2.test.mjs"],"acceptanceIds":["AP-02","AP-17"],"sourceRefs":["S13","S14"],"implementationSteps":["Resolver ownership/capabilities por descriptor/policy e registry vigente, não cardinalidade fixa ou nome de pasta.","Selecionar reviews por impacto e dependências de fatos; compiler continua autoridade do DAG e de overlap global.","Permitir tarefas determinísticas explicitamente classificadas sem eliminar review semântico necessário."],"redTests":["Dois owners no mesmo arquivo falham mesmo se serializados.","Capability obrigatória ausente e incremento de domínio não viram no-impact automático."],"deliverables":["workflow compiler e presets versionados","ownership/capability contracts","grafo determinístico com razões de seleção"],"rollback":"Retornar preset SDD v1 explícito; o catálogo versionado antigo permanece legível para runs em andamento.","commonContract":"README.md","contextPacketId":"T05"}
